{
  "artifact": {
    "content_fingerprint": "sha256:eab84892287f66d78a45aec905a386e97fc3ce44c818f4f90aecf9131f5f028e",
    "inventory": "plugins/governed-engineering-skills/artifact-inventory.json",
    "name": "governed-engineering-skills",
    "version": "0.23.2"
  },
  "channel": "personal-git-marketplace",
  "evidence_checklist": [
    "Codex resolves the expected Plugin name, version, Git reference, and fingerprint",
    "Codex Desktop or CLI invokes one representative engineering Skill",
    "Codex Desktop or CLI invokes one representative productivity Skill"
  ],
  "git_ref": "marketplace-release",
  "installation_steps": [
    "Add https://github.com/ShinWeiPeng/skills.git as a personal Git Marketplace",
    "Use Git reference marketplace-release",
    "Use sparse paths .agents/plugins, plugins/governed-engineering-skills",
    "Install the governed Plugin in Codex Desktop or Codex CLI"
  ],
  "marketplace_path": ".agents/plugins/marketplace.json",
  "repository_url": "https://github.com/ShinWeiPeng/skills.git",
  "rollback": {
    "method": "Restore marketplace-release to the previous validated generated commit",
    "previous_publication_commit": "d231318e635846ba1af5b5089e822a79ce803f83"
  },
  "schema_version": "1.0.0",
  "source_commit": "b9b55b96530c644baa941c67301c341a09a4efcc",
  "source_tag": "governed-engineering-skills@0.23.2",
  "source_tag_commit": "b9b55b96530c644baa941c67301c341a09a4efcc",
  "sparse_paths": [
    ".agents/plugins",
    "plugins/governed-engineering-skills"
  ],
  "tree_fingerprint": "sha256:7297dd0c64329018e4980a37c887f564406b917d404e62aeb78c119f216c6a02"
}
